{
  "$schema": "http://json-schema.org/draft-07/schema#",
  "type": "object",
  "title": "auditLogViewer Configuration Schema",
  "description": "Auto-generated schema for auditLogViewer configuration",
  "_generated": "2025-09-27T07:05:06.917Z",
  "_generator": "componentSchemaGenerator v1.0.0",
  "_version": "0.1.0",
  "properties": {
    "component": {
      "type": "object",
      "properties": {
        "name": {
          "type": "string",
          "minLength": 1
        },
        "version": {
          "type": "string",
          "minLength": 1
        },
        "description": {
          "type": "string",
          "minLength": 1,
          "maxLength": 1000
        },
        "author": {
          "type": "string",
          "minLength": 1
        },
        "created": {
          "type": "string",
          "minLength": 1
        },
        "type": {
          "type": "string",
          "minLength": 1
        }
      },
      "additionalProperties": true
    },
    "ui": {
      "type": "object",
      "properties": {
        "display": {
          "type": "object",
          "properties": {
            "width": {
              "type": "string",
              "minLength": 1
            },
            "height": {
              "type": "string",
              "minLength": 1
            },
            "responsive": {
              "type": "boolean"
            },
            "touchOptimized": {
              "type": "boolean"
            },
            "landscapeMode": {
              "type": "boolean"
            }
          },
          "additionalProperties": true
        },
        "layout": {
          "type": "object",
          "properties": {
            "header": {
              "type": "boolean"
            },
            "filters": {
              "type": "boolean"
            },
            "stats": {
              "type": "boolean"
            },
            "table": {
              "type": "boolean"
            },
            "pagination": {
              "type": "boolean"
            },
            "modal": {
              "type": "boolean"
            }
          },
          "additionalProperties": true
        },
        "theme": {
          "type": "object",
          "properties": {
            "colorScheme": {
              "type": "string",
              "minLength": 1
            },
            "primaryColor": {
              "type": "string",
              "pattern": "^#[0-9a-fA-F]{6}$",
              "description": "Hex color code",
              "minLength": 1
            },
            "dangerColor": {
              "type": "string",
              "pattern": "^#[0-9a-fA-F]{6}$",
              "description": "Hex color code",
              "minLength": 1
            },
            "warningColor": {
              "type": "string",
              "pattern": "^#[0-9a-fA-F]{6}$",
              "description": "Hex color code",
              "minLength": 1
            },
            "successColor": {
              "type": "string",
              "pattern": "^#[0-9a-fA-F]{6}$",
              "description": "Hex color code",
              "minLength": 1
            }
          },
          "additionalProperties": true
        }
      },
      "additionalProperties": true
    },
    "data": {
      "type": "object",
      "properties": {
        "refreshInterval": {
          "type": "number",
          "minimum": 0
        },
        "pageSize": {
          "type": "number",
          "minimum": 0
        },
        "maxDisplayLogs": {
          "type": "number",
          "minimum": 0
        },
        "timeRanges": {
          "type": "array",
          "items": {
            "type": "string",
            "minLength": 1
          },
          "minItems": 0
        },
        "exportFormats": {
          "type": "array",
          "items": {
            "type": "string",
            "minLength": 1
          },
          "minItems": 0
        },
        "autoRefresh": {
          "type": "boolean"
        }
      },
      "additionalProperties": true
    },
    "responsive": {
      "type": "object",
      "properties": {
        "breakpoints": {
          "type": "object",
          "properties": {
            "small": {
              "type": "string",
              "minLength": 1
            },
            "medium": {
              "type": "string",
              "minLength": 1
            },
            "large": {
              "type": "string",
              "minLength": 1
            }
          },
          "additionalProperties": true
        },
        "display79": {
          "type": "object",
          "properties": {
            "width": {
              "type": "string",
              "minLength": 1
            },
            "height": {
              "type": "string",
              "minLength": 1
            },
            "orientation": {
              "type": "string",
              "minLength": 1
            },
            "scaling": {
              "type": "string",
              "minLength": 1
            }
          },
          "additionalProperties": true
        }
      },
      "additionalProperties": true
    },
    "accessibility": {
      "type": "object",
      "properties": {
        "keyboardNavigation": {
          "type": "boolean"
        },
        "screenReader": {
          "type": "boolean"
        },
        "highContrast": {
          "type": "boolean"
        },
        "focusManagement": {
          "type": "boolean"
        },
        "ariaLabels": {
          "type": "boolean"
        }
      },
      "additionalProperties": true
    },
    "performance": {
      "type": "object",
      "properties": {
        "virtualScrolling": {
          "type": "boolean"
        },
        "lazyLoading": {
          "type": "boolean"
        },
        "caching": {
          "type": "boolean"
        },
        "debounceSearch": {
          "type": "number",
          "minimum": 0
        },
        "maxMemoryUsage": {
          "type": "string",
          "minLength": 1
        }
      },
      "additionalProperties": true
    },
    "security": {
      "type": "object",
      "properties": {
        "roleBasedAccess": {
          "type": "boolean"
        },
        "auditLogging": {
          "type": "boolean"
        },
        "dataValidation": {
          "type": "boolean"
        },
        "exportPermissions": {
          "type": "boolean"
        },
        "allowedRoles": {
          "type": "array",
          "items": {
            "type": "string",
            "minLength": 1
          },
          "minItems": 0
        },
        "sensitiveDataMasking": {
          "type": "boolean"
        }
      },
      "additionalProperties": true
    }
  },
  "required": [
    "component",
    "ui",
    "data",
    "responsive",
    "accessibility",
    "performance",
    "security"
  ],
  "additionalProperties": false
}
